id,tweet,défigement_identifié,expression_reconnue,remarques
1435140654414376964',Liberté égalité fraternité pôle emploi https://t.co/k0VKk2kIz7,non,oui,défigement d'une autre seed
1529123131679383552',"Il a pourtant traversé la rue.
Bienvenu au Pôle emploi 😏 https://t.co/Lyfnleg1lZ",non,oui,
1547526660462968833',@paul_denton Bah qu'il traverse la rue pour aller à Pôle Emploi !,non,oui,défigement d'une autre seed
1582794505946025984',"@TPMP Pas de case pôle emploi , il a juste traversé la rue !",non,oui,
1605913073780494338',@TPMP Une radiation de pôle emploi parce que je suis handicapé ♿ et que je ne peux plus travailler.,non,oui,
