id,tweet,défigement_identifié_final,expression_reconnue_finale,défigement_identifiéA3,expression_reconnueA3,remarquesA3,défigement_identifiéA2,expression_reconnueA2,remarquesA2,défigement_identifiéA1,expression_reconnueA1,remarquesA1
1341145186827689992',"ce moment dans Harry Potter et la chambre des secrets où il y a les araignées, comment dire 😶🙃🥴💀",non,non,non,non, , , , ,non,non, 
1501542412916822018',"La nouvelle femme de ménage elle passe plus de temps au téléphone assise dans la chambre des filles qu'à travailler. 
C'est bien ma puce, eat the rich",non,non,non,non, , , , ,non,non, 
1552383068220030979',La Chambre des merveilles : une ode à l'amour de la vie à l'approche de la mort - La Grande Parade https://t.co/phSFu5oWZQ,non,non,non,non, , , , ,non,non, 
1552377179996053504',La Chambre des merveilles : une ode à l'amour de la vie à l'approche de la mort  https://t.co/TGKZmTQntu @avignonoff1,non,non,non,non, , , , ,non,non, 
1559480104706867202',"Depuis 2020, la Chambre des députés compte 400 membres (contre 630 auparavant), et le Sénat 200 (contre 315).

Jusqu'ici, tout va bien...",non,non,non,non, , , , ,non,non, 
