id,tweet,défigement_identifié_final,expression_reconnue_finale,défigement_identifiéA1,expression_reconnueA1,remarquesA1,défigement_identifiéA2,expression_reconnueA2,remarquesA2,défigement_identifiéA3,expression_reconnueA3,remarquesA3
1332038327600603151',"Liberté , égalité et fraternité mon cul. https://t.co/OXK975PPMQ",non,oui,non,oui, , ,X, ,non,non, 
1448375513437937668',"@BronnMuller @GuillaumeBarucq @lesRep_Senat @loichervepublic @SenateurMilon @publicsenat @dnatweets @amihebdo Je vous remercie pour votre intervention de ce jour.
Vous représentez dignement les valeurs de la République : liberté, égalité et fraternité !
Un grand Bravo et encore un grand  MERCI",non,oui,non,oui, , ,X, ,non,non, 
1491470253313900549',Liberté égalité et fraternité des mots vides de sens dans la république de la discrimination ! https://t.co/luoBWtjD3v,non,oui,non,oui, , ,X, ,non,non, 
1554537845704085510',"Oui cher @EricNaulleau L’islamogauchisme de la #NUPES est un poison pour la liberté l’égalité la fraternité certains #LFI ont reçu le soutien de @jeremycorbyn d’autres expriment leur haine d’#Israel, apportent leur soutien à un iman radical, commémorent #Robespierre…au secours https://t.co/jlBAZBRhnn",non,oui,non,oui, , ,X, ,non,non, 
1568870509168979970',"Je ne sais pas ce qu'il reste de ces 3 mots :
Liberté, égalité et fraternité !",non,oui,non,oui, , ,X, ,non,non, 
