id,tweet,défigement_identifié,expression_reconnue,remarques
1458125097575796749',@ASPelletier @d5343313 La Bielioussie ne peut pas non plus accueillir toute la misère du monde. Qui est responsable de cet afflux de migrants? Les Bielorusses ou l'europe et les E-U? Curieux. On pourrait s'attendre à un peu plus de recul.,oui,oui,
1472980521747685382',"Michel Rocard disait on ne peut accueillir  toute la misère du monde,un autre a dit:la France on l aime ou on la quitte,.il faut absolument  et vitalement stopper l emigration.quand ON bénéficie de lhospitalité de la France on se doit d avoir une attitude exemplaire.C pas le cas",non,oui,
1494568010199322640',"@souph33 @RigambertInes @AQuatennens @melenchon_2022 @FranceInsoumise @JLMelenchon On n’a pas à recevoir toute la misère du monde, et on ne le fera pas. Rendre français tous ces gens qui détestent la France et qui veulent juste notre système social et notre système de santé, c’est une honte. Il va bientôt avoir une fuite de la France, mais des cerveaux 1/2",oui,oui,
1459526420582080523',"En bon socialiste, Michel Rocard déclarait en 1990 : 
« la France ne peut pas accueillir toute la misère du monde, mais elle doit en prendre fidèlement sa part ».
C'est bon Michel ! Objectif dépassé ! 
On ne sait plus quoi faire du rab.",non,oui,
1430498584538009602',"@RobertMenardFR Je crois que Michel Rocard  ( socialiste de surcroit )avait  simplement dit....
la France ne peut pas accueillir toute la misère du monde....
Qu'est qu'on fait????",non,oui,
